{
  "schema_version": 1,
  "park_id": "NYY",
  "name": "Yankee Stadium",
  "altitude_m": 16.0,
  "default_atmosphere": {
    "temp_c": 20.0,
    "pressure_hpa": null,
    "humidity_pct": 50.0
  },
  "centerline_bearing_deg": 28.0,
  "fence_polyline": [
    {
      "angle_from_centerline_deg": -45.0,
      "distance_ft": 314,
      "height_ft": 8.0
    },
    {
      "angle_from_centerline_deg": -22.5,
      "distance_ft": 385,
      "height_ft": 8.0
    },
    {
      "angle_from_centerline_deg": 0.0,
      "distance_ft": 408,
      "height_ft": 8.0
    },
    {
      "angle_from_centerline_deg": 22.5,
      "distance_ft": 399,
      "height_ft": 8.0
    },
    {
      "angle_from_centerline_deg": 45.0,
      "distance_ft": 318,
      "height_ft": 8.0
    }
  ],
  "behind_fence_stand_height_ft": 25.0,
  "foul_territory_sqft": 22000
}
