{
  "schema_version": 1,
  "park_id": "MIL",
  "name": "American Family Field",
  "altitude_m": 195.0,
  "default_atmosphere": {
    "temp_c": 20.0,
    "pressure_hpa": null,
    "humidity_pct": 50.0
  },
  "centerline_bearing_deg": 40.0,
  "fence_polyline": [
    {
      "angle_from_centerline_deg": -45.0,
      "distance_ft": 345,
      "height_ft": 8.0
    },
    {
      "angle_from_centerline_deg": -22.5,
      "distance_ft": 374,
      "height_ft": 8.0
    },
    {
      "angle_from_centerline_deg": 0.0,
      "distance_ft": 400,
      "height_ft": 8.0
    },
    {
      "angle_from_centerline_deg": 22.5,
      "distance_ft": 371,
      "height_ft": 8.0
    },
    {
      "angle_from_centerline_deg": 45.0,
      "distance_ft": 344,
      "height_ft": 8.0
    }
  ],
  "behind_fence_stand_height_ft": 25.0,
  "foul_territory_sqft": 23000
}
