{
  "schema_version": 1,
  "park_id": "CIN",
  "name": "Great American Ball Park",
  "altitude_m": 150.0,
  "default_atmosphere": {
    "temp_c": 20.0,
    "pressure_hpa": null,
    "humidity_pct": 50.0
  },
  "centerline_bearing_deg": 30.0,
  "fence_polyline": [
    {
      "angle_from_centerline_deg": -45.0,
      "distance_ft": 325,
      "height_ft": 12
    },
    {
      "angle_from_centerline_deg": -22.5,
      "distance_ft": 370,
      "height_ft": 12
    },
    {
      "angle_from_centerline_deg": 0.0,
      "distance_ft": 404,
      "height_ft": 12
    },
    {
      "angle_from_centerline_deg": 22.5,
      "distance_ft": 379,
      "height_ft": 12
    },
    {
      "angle_from_centerline_deg": 45.0,
      "distance_ft": 328,
      "height_ft": 12
    }
  ],
  "behind_fence_stand_height_ft": 25.0,
  "foul_territory_sqft": 22000
}
